{
  "files": [
    {
      "kind": "lexlean-build-manifest",
      "sha256": "3779d20d45e41bf56ce8ca65e57767e527f14e56d028f1bb8116d87e08ac080a"
    },
    {
      "kind": "lean4-prod-coverage",
      "sha256": "1425e23c87b4664a712626e1ea5f6c2662726c3a8f397f4ed9f4bc5d798537da"
    },
    {
      "kind": "lean4-prod-kernel-ir",
      "sha256": "225392607af4149680d07b029ce3213cda6516390a73e422802e13aa61d2678a"
    },
    {
      "kind": "model-document",
      "sha256": "074921890f5c372c89f4ed794d26dd550231d5e9bf99bf9474cc1a78923292c6"
    }
  ],
  "semantic_id": "be75c14a6c6ae7c21e0bf6abe3c6312cf107fee86d6a01092306ba7162d4a949",
  "source_id": "63611de07b58d03b3a9976b34138d903215e50c53ec2ba4ee3cdeb452b0710ad",
  "version": 4
}
